{
  "measured_at": "2026-08-12T11:59:00Z",
  "control_host": "control-host-01",
  "processes": { "planner": null, "watcher": null, "supervisor": null },
  "queue_counts": [],
  "actors": [
    {
      "actor_id": "actor-alpha",
      "current_task": null,
      "closed": [],
      "incidents": [
        {
          "incident_id": "inc-1",
          "opened_at": "2026-08-12T11:50:00Z",
          "severity": "LOW",
          "note": "verbinding faalde met GITHUB_TOKEN=ghp_abcdefghijklmnopqrstuvwxyz012345 in de omgeving"
        }
      ]
    }
  ],
  "accounts": [
    { "account_id": "acct-mini", "label": "sk-abcdefghijklmnopqrstuvwx", "status": "OK", "last_seen": "2026-08-12T11:59:00Z" }
  ]
}
