{
  "measured_at": "2026-08-12T11:59:00Z",
  "control_host": "control-host-01",
  "processes": {
    "planner": { "pid": 101, "boot_id": "boot-abc", "loaded_sha": "a1b2c3d4e5f6", "heartbeat": "2026-08-12T11:58:30Z" },
    "watcher": null,
    "supervisor": null
  },
  "queue_counts": [{ "name": "planner_queue", "count": 5 }],
  "actors": [
    { "actor_id": "actor-alpha", "current_task": null, "closed": [], "incidents": [] },
    { "actor_id": "actor-bravo", "current_task": null, "closed": [], "incidents": [] }
  ],
  "accounts": []
}
